{
  "description": "整句识别（parseCookQuery）用的词表，Web 和 iOS 共用。食材名来自 food.json 和 aliases.json，这里只放句子里的功能词和补充写法。同一个词只能出现在一个地方。",
  "stuff": {
    "蛋": "鸡蛋",
    "鸡": "鸡肉",
    "鸭": "鸭肉",
    "羊": "羊肉"
  },
  "ignore": ["小米", "糯米", "米线", "米粉", "米酒", "蛋糕", "蛋挞", "皮蛋", "鸭蛋", "咸蛋", "鹌鹑蛋", "鸡精", "鱼香", "鱼露"],
  "tools": {
    "炒锅": "一口大锅",
    "大锅": "一口大锅",
    "电饭锅": "电饭煲"
  },
  "have": ["有", "还有", "只有", "剩", "剩下", "想吃", "想做", "用"],
  "avoid": ["不要", "不吃", "不放", "不加", "别放", "别加", "不想吃", "不爱吃", "不喜欢", "不能吃", "忌口", "去掉", "过敏"],
  "lack": ["没有", "没了", "没", "缺"],
  "noSpicy": ["不辣", "不要辣", "不吃辣", "不能吃辣", "不太辣", "别太辣", "不要太辣", "不放辣", "别放辣", "不加辣", "不要辣椒", "不吃辣椒", "不放辣椒", "清淡"],
  "difficulty": {
    "简单": ["简单", "快手", "新手", "懒人", "省事", "容易", "不难", "别太难", "不要太难", "方便", "分钟"],
    "困难": ["硬菜", "大菜", "有难度", "难一点", "挑战"]
  },
  "methodGroups": {
    "炒菜": ["炒", "炒菜", "小炒", "爆炒"],
    "汤羹": ["汤", "煲汤", "喝汤", "汤羹"],
    "炖煮": ["炖", "煮", "焖", "卤", "红烧", "炖煮"],
    "蒸": ["蒸", "清蒸"],
    "炸煎": ["炸", "煎", "油炸", "香煎"],
    "烤": ["烤", "烧烤", "烘"],
    "凉拌": ["凉拌", "拌"],
    "微波": ["微波"]
  }
}
